0,1,2
(Address of principal executive offices),,(Zip Code)
,"Registrant's telephone number, including area code: (408) 765-8080",
,Securities registered pursuant to Section 12(b) of the Act:,
Title of each class,Trading symbol,Name of each exchange on which registered
"Common stock, $0.001 par value",INTC,Nasdaq Global Select Market
,Securities registered pursuant to Section 12(g) of the Act: None,
"Indicate by check mark if the registrant is a well-known seasoned issuer, as defined in Rule 405 of the Securities Act.    Yes ☑  No ☐",,
