0,1,2,3
"levels and purchasing practices, and selling certain of our accounts receivable on a non-recourse basis to third-party financial institutions. While such actions have benefited, and",,,
"may further benefit, cash flow in the near term, we may experience a corresponding detriment to cash flow in future periods as these actions cease or as the impacts of these",,,
actions reverse or normalize.,,,
Our cash flows for each period were as follows:,,,
Years Ended (In Millions),"Dec 30, 2023","Dec 31, 2022","Dec 25, 2021"
