Definition,Usefulness to management and investors
A portion of the charge from our IP settlements represents a catch-up ofcumulative amortization that would have been incurred for the right to usethe related patents in prior periods. This charge related to prior periods isexcluded from our non-GAAP results; amortization related to the right touse the patents in the current and ongoing periods is included.,We exclude the catch-up charge related to prior periods for purposes ofcalculating certain non-GAAP measures because this adjustmentfacilitates comparison to past operating results and provides a usefulevaluation of our current operating performance.
A charge in 2022 as we initiated the wind-down of our Intel Optanememory business.,We exclude these impairments for purposes of calculating certain non-GAAP measures because these charges do not reflect our currentoperating performance. This adjustment facilitates a useful evaluation ofour current operating performance and comparisons to past operatingresults.
"Restructuring charges are costs associated with a formal restructuringplan and are primarily related to employee severance and benefitarrangements. Other charges may include periodic goodwill and assetimpairments, certain pension charges, and costs associated withrestructuring activity. 2023 includes a benefit as a result of developmentsin the VLSI litigation in Q4 2023, an EC-imposed fine, and a fee related tothe termination of our agreement to acquire Tower. 2022 includes a benefitrelated to the annulled EC fine and 2021 includes a charge related to theVLSI litigation.","We exclude restructuring and other charges, including any adjustments tocharges recorded in prior periods, for purposes of calculating certain non-GAAP measures because these costs do not reflect our core operatingperformance. These adjustments facilitate a useful evaluation of our coreoperating performance and comparisons to past operating results andprovide investors with additional means to evaluate expense trends."
"losses on equity investments, net consists of ongoing mark-to-market adjustments on marketable equity securities, observable priceadjustments on non-marketable equity securities, related impairmentcharges, and the sale of equity investments and other.",We exclude these non-operating gains and losses for purposes ofcalculating certain non-GAAP measures because it provides bettercomparability between periods. The exclusion reflects how managementevaluates the core operations of the business.
"losses are recognized at the close of a divestiture, or over aspecified deferral period when deferred consideration is received at thetime of closing. Based on our ongoing obligation under the NAND wafermanufacturing and sale agreement entered into in connection with the firstclosing of the sale of our NAND memory business on December 29, 2021,a portion of the initial closing consideration was deferred and will berecognized between first and second closing.",We exclude gains or losses resulting from divestitures for purposes ofcalculating certain non-GAAP measures because they do not reflect ourcurrent operating performance. These adjustments facilitate a usefulevaluation of our current operating performance and comparisons to pastoperating results.
"We reference a non-GAAP financial measure of adjusted free cash flow,which is used by management when assessing our sources of liquidity,capital resources, and quality of earnings. Adjusted free cash flow isoperating cash flow adjusted for (1) additions to property, plant, andequipment, net of proceeds from capital-related government incentivesand partner contributions, (2) payments on finance leases, and (3)proceeds from the McAfee equity sale in ","This non-GAAP financial measure is helpful in understanding our capitalrequirements and sources of liquidity by providing an additional means toevaluate the cash flow trends of our business. Since the 2017 divestiture,McAfee equity distributions and sales contributed to prior operating andfree cash flow, and while the McAfee equity sale in Q1 2022 would havetypically been excluded from adjusted free cash flow as an equity sale, webelieve including the sale proceeds in adjusted free cash flow facilitate abetter, more consistent comparison to current and past presentations ofliquidity."
"Total cash and investments is used by management when assessing oursources of liquidity, which include cash and cash equivalents, short-terminvestments, and loans receivable and other.",This non-GAAP measure is helpful in understanding our capital resourcesand liquidity position.
